{
  "schema_version": "1",
  "scenario_id": "narrow-pool",
  "scenario_version": 1,
  "scenario_class": "high_cardinality",
  "provenance": "synthetic_design_assumption",
  "provenance_note": "Long enough to draw plenty of events, but from a pool far too small to reach five hundred distinct viewers: the stream repeats the same dozen actors. This isolates the declared-pool half of the cardinality rule from the event-count half, so neither can be dropped without a fixture noticing.",
  "seed": 20261004,
  "logical_start": "2026-10-01T00:00:00Z",
  "stream_duration_ms": 4800000,
  "phases": [
    {
      "name": "crowd",
      "duration_ms": 4800000,
      "events_per_minute": 10.0,
      "kind_mix": {
        "chat.message": 9.0,
        "game.event": 1.0
      },
      "semantic_mix": {
        "hit": 0.6,
        "near_miss": 0.3,
        "miss": 0.1
      },
      "priority_mix": {
        "low": 4.0,
        "normal": 2.0,
        "high": 1.0
      },
      "distinct_actors": 40,
      "distinct_topics": 500,
      "repeat_viewer_probability": 0.0
    }
  ]
}