{
  "schema_version": "1",
  "scenario_id": "no-idle",
  "scenario_version": 1,
  "scenario_class": "idle_to_burst",
  "provenance": "synthetic_design_assumption",
  "provenance_note": "Claims an idle-to-burst shape but never goes idle.",
  "seed": 20261004,
  "logical_start": "2026-10-01T00:00:00Z",
  "stream_duration_ms": 120000,
  "phases": [
    {
      "name": "steady",
      "duration_ms": 60000,
      "events_per_minute": 1.0,
      "kind_mix": {
        "chat.message": 9.0,
        "game.event": 1.0
      },
      "semantic_mix": {
        "hit": 0.6,
        "near_miss": 0.3,
        "miss": 0.1
      },
      "priority_mix": {
        "low": 4.0,
        "normal": 2.0,
        "high": 1.0
      },
      "distinct_actors": 12,
      "distinct_topics": 8,
      "repeat_viewer_probability": 0.4
    },
    {
      "name": "spike",
      "duration_ms": 60000,
      "events_per_minute": 10.0,
      "kind_mix": {
        "chat.message": 9.0,
        "game.event": 1.0
      },
      "semantic_mix": {
        "hit": 0.6,
        "near_miss": 0.3,
        "miss": 0.1
      },
      "priority_mix": {
        "low": 4.0,
        "normal": 2.0,
        "high": 1.0
      },
      "distinct_actors": 12,
      "distinct_topics": 8,
      "repeat_viewer_probability": 0.4
    }
  ]
}
