{
  "schema_version": "1",
  "scenario_id": "chat-burst-10x",
  "scenario_version": 1,
  "scenario_class": "burst",
  "provenance": "synthetic_design_assumption",
  "provenance_note": "A tenfold chat ramp over thirty seconds, the abrupt burst shape #79 needs. The absolute rate stays inside what the starter pack can play (measured at 15 events/minute); the burst is expressed as the ratio, which is what the issue asks to vary.",
  "seed": 4242,
  "logical_start": "2026-10-01T00:00:00Z",
  "stream_duration_ms": 120000,
  "phases": [
    {
      "name": "baseline",
      "duration_ms": 60000,
      "events_per_minute": 1.0,
      "kind_mix": {
        "chat.message": 9.0,
        "game.event": 1.0
      },
      "semantic_mix": {
        "hit": 0.6,
        "near_miss": 0.3,
        "miss": 0.1
      },
      "priority_mix": {
        "low": 4.0,
        "normal": 2.0,
        "high": 1.0
      },
      "distinct_actors": 12,
      "distinct_topics": 8,
      "repeat_viewer_probability": 0.4
    },
    {
      "name": "burst",
      "duration_ms": 60000,
      "events_per_minute": 10.0,
      "kind_mix": {
        "chat.message": 9.0,
        "game.event": 1.0
      },
      "semantic_mix": {
        "hit": 0.6,
        "near_miss": 0.3,
        "miss": 0.1
      },
      "priority_mix": {
        "low": 4.0,
        "normal": 2.0,
        "high": 1.0
      },
      "distinct_actors": 40,
      "distinct_topics": 25,
      "repeat_viewer_probability": 0.4
    }
  ]
}
