{
  "schema_version": "1",
  "scenario_id": "dense-but-inconsistent",
  "scenario_version": 1,
  "scenario_class": "high_cardinality",
  "provenance": "synthetic_design_assumption",
  "provenance_note": "Two contradictions on purpose, each isolated: a rate the cached replay path refuses, and a phase that claims four thousand viewers while running long enough for a handful of events. The first is a consumer limit; the second is a format defect, and the validator has to tell them apart rather than treating a refusal as a broken document.",
  "seed": 20261004,
  "logical_start": "2026-10-01T00:00:00Z",
  "stream_duration_ms": 120000,
  "phases": [
    {
      "name": "crowd",
      "duration_ms": 120000,
      "events_per_minute": 30,
      "kind_mix": {
        "chat.message": 9.0,
        "game.event": 1.0
      },
      "semantic_mix": {
        "hit": 0.6,
        "near_miss": 0.3,
        "miss": 0.1
      },
      "priority_mix": {
        "low": 4.0,
        "normal": 2.0,
        "high": 1.0
      },
      "distinct_actors": 4000,
      "distinct_topics": 500,
      "repeat_viewer_probability": 0.05
    }
  ]
}